,text,date,label,label_name,id
1771,Jade has to bee the masked singer {@Little Mix@} please say I’m not wrong #MaskedSinger I’m losing my mind,2020-02-09,2,pop_culture,1226457024449437696
1772,Jennifer Lopez & Live Nation Partner in Multi-Year Touring Deal: Exclusive {{URL}} via {@billboard@},2020-02-09,2,pop_culture,1226457199607574528
1773,Johnny Manziel rips the XFL while praising himself {{URL}} via {@New York Post Sports@} ......TO ME....WHAT MIGHT OF BEEN......,2020-02-09,4,sports_&_gaming,1226457931723550722
1774,Check out Patrick Mahomes Football Display Case W/ A Kansas City Chiefs Engraved Nameplate {{URL}} via {{USERNAME}} #PatrickMahomes #ChiefsKingdom #SuperBowl #FootballCase #EngravedNameplates available at {{URL}},2020-02-09,4,sports_&_gaming,1226459060691783681
1775,Check out Patrick Mahomes Football Mini Helmet Display Case With A Chiefs Nameplate #BobbysHangUps {{URL}} via {{USERNAME}} #PatrickMahomes #ChiefsKingdom #SuperBowl #MiniHelmetCase #EngravedNameplates available at {{URL}},2020-02-09,4,sports_&_gaming,1226459591564824576
1776,"Buzzing for birds of prey with {{USERNAME}} , {{USERNAME}} & {{USERNAME}}  #BirdsOfPreyMovie",2020-02-09,2,pop_culture,1226459843881558017
1777,Check out Patrick Mahomes Chiefs Autograph Nameplate For A Football Jersey Case 1.25 X 6 {{URL}} via {{USERNAME}} #PatrickMahomes #ChiefsKingdom #SuperBowl  #EngravedNameplate available at {{URL}},2020-02-09,4,sports_&_gaming,1226460470128803841
1778,Check out Patrick Mahomes Chiefs Engraved Nameplate For A Football Jersey Case 1.5 X 6 {{URL}} via {{USERNAME}} #PatrickMahomes #ChiefsKingdom #SuperBowl  #EngravedNameplate available at {{URL}},2020-02-09,4,sports_&_gaming,1226460705307664389
1779,"The biggest snubs of the Oscars 2020 shortlist, from Jennifer Lopez to Adam Sandler {{URL}} via {@Telegraph Film@} ",2020-02-09,2,pop_culture,1226464952032034818
1780,I just added this listing on Poshmark: NWT Jennifer Lopez Boyfriend Jeans. {{URL}} via {@Poshmark@} #shopmycloset,2020-02-09,2,pop_culture,1226464998748192768
1781,I just discovered this on Poshmark: JENNIFER LOPEZ Gold shimmer straight leg pants. {{URL}} via {@Poshmark@},2020-02-09,2,pop_culture,1226468770119438337
1782,Check out VINTAGE 2002 KANSAS CITY CHIEFS REEBOK ON FIELD ADJUSTABLE EMBROIDERED CAP NWT #Reebok {{URL}} via {{USERNAME}},2020-02-09,4,sports_&_gaming,1226469003423432704
1783,Very good news for Katherine this week. The Platinum Collection has gone up to No40 and Guiding Light has gone up to No41 ! The Masked Singer is working wonders !! {{URL}} via {@Official Charts@},2020-02-09,2,pop_culture,1226470369890119684
1784,"Birds Of Prey’s Opening Weekend Is Seriously Underperforming, But Why? – CinemaBlend {{URL}} via {{USERNAME}} ",2020-02-09,2,pop_culture,1226472160002289665
1785,Lauren knows who the Hedgehog is on the masked singer..... it’s {@Hugh Jackman@} ! You heard it here first! Il be retweeting this when it’s revealed! #yeahwewatchit #maskedsinger,2020-02-09,2,pop_culture,1226473821206695937
1786,Bob Marley & The Wailers - Redemption Song (Official Video) {{URL}} {@YouTube@} より,2020-02-09,2,pop_culture,1226474878003335168
1787,Box Office: ‘Birds Of Prey’ Disappoints With Mediocre $13M Friday via {@Forbes@} {{URL}},2020-02-09,2,pop_culture,1226475801442430977
1788,#partytrain w/ {{USERNAME}} My Woman Is Gone by Bob Marley Visit {{URL}},2020-02-09,2,pop_culture,1226498601569964032
1789,Check out 1979 World series fan helmet {{URL}} via {{USERNAME}},2020-02-09,4,sports_&_gaming,1226503764842029056
1790,The latest Cheering for the NFL ! {{URL}} Thanks to {{USERNAME}} {{USERNAME}},2020-02-09,4,sports_&_gaming,1226505317418250246
1791,Imagine still watching the NFL. Millionaires play a contrived game for hours on end for the benefit of billionaires. It s 2020 baby It s {{USERNAME}} time.,2020-02-09,4,sports_&_gaming,1226506030118506503
1792,So are people giving the {{USERNAME}} a go while the off season of the NFL? What time are you backing?or just enjoying not backing a team and the stress,2020-02-09,4,sports_&_gaming,1226527953015779331
1793,"Big show tonight ! Daytona {{USERNAME}} winner {@VenturiniMotorsports@} {@Michael Self@} will join us live , also in the race with a 6th {@Jason White@} plus {@NASCAR Camping World Trucks@} Series director Brad Moran & more form {{USERNAME}} World Series 645 pm on our stream {@SXMCanadaTalks@} 167 9pm ET",2020-02-09,4,sports_&_gaming,1226529154964893696
1794,Busy day for sports watching. {@MSU Lady Bears@} at 2 and the {@St Louis BattleHawks@} at 4. Thankfully the NFL season has me in shape for days like these.,2020-02-09,4,sports_&_gaming,1226530020539195392
1795,Yo {@Tyrann Mathieu@} I think you need to reach out to the 10 year Doni Morales who lost his football to you guys at the parade when Patrick mahomes threw it. {{URL}},2020-02-09,4,sports_&_gaming,1226532454988746752
1796,Join {@Mark Zinno@} and myself as we broadcast live from Life University this afternoon from noon to three. Few things we’ll get to...  Did Zinno make money off the XFL yesterday? Kevin Durant is still soft. Zinno on the Red Carpet National Signing Day {@680 The Fan@},2020-02-09,4,sports_&_gaming,1226533654287048704
1797,Five Reasons People Apparently Don’t Want To Watch Harley Quinn In ‘Birds Of Prey’ via {@Forbes@} {{URL}},2020-02-09,2,pop_culture,1226534153782472713
1798,Birds of Prey debuted with an estimated $48.0M internationally.  Global total stands at $81.3M.  #BirdsOfPrey  #BoxOffice {@Warner Bros Pictures@} {@Birds of Prey@},2020-02-09,2,pop_culture,1226534619371233280
1799,"SPT FANS! We are less than 10 minutes away from show time! We are recapping the Super Bowl, the start of the XFL season, the NBA trade deadline and the playoff race!  Tune in 11-1 only on {{USERNAME}} #SPT",2020-02-09,4,sports_&_gaming,1226534742335488001
1800,"I’m on {@Mad Dog Sports Radio@} this morning from 10am-2pm CT. What do we want in a sports apology? My early thoughts on the XFL, plus Tom Brady’s future.  My friend {@Mark Medina@} joins me at 10:35 CT, {@Tom Luginbill@} at 11 CT",2020-02-09,4,sports_&_gaming,1226535382046605313
1801,Real sad that {@ELI@} doesn’t have an NFL roster spot. But he will continue to ball out in the XFL! Opportunities!! ✊,2020-02-09,4,sports_&_gaming,1226535804346028037
1802,"Shout out to our boy {@PJ Walker@} . Hell of a game yesterday leading the #HoustonRoughnecks to a 37-17 victory. This was a magnificent display of the incredible talent, true grit, and pure love for the game of football the XFL embodies. #AllThingsXFL",2020-02-09,4,sports_&_gaming,1226560180239970305
1803,Obo Okoronkwo explains the key to having success in the NFL {{URL}} via {@Rams Wire@},2020-02-09,4,sports_&_gaming,1226560319956275200
1804,. {@Kansas City Chiefs@} (& {@Florida State University@} alum) {@Derrick Nnadi@} celebrates #SuperBowl win by paying off animal shelter adoption fees. {{URL}} via {@CBS News@},2020-02-09,4,sports_&_gaming,1226560910803730432
1805,"Report: Redskins hiring Jennifer King as assistant, the NFL’s first full-time black female coach {{URL}} via {@Yahoo Sports@} ",2020-02-09,4,sports_&_gaming,1226561578885099520
1806,Unearthing this from 2014 when {@Laurent D Tardif@} was just drafted by the NFL.  5 things you didn’t know about: Laurent Duvernay-Tardif | {{URL}} {{URL}},2020-02-09,4,sports_&_gaming,1226562262183432192
1807,"The XFL as a whole should be really proud. Liking what every team has to offer, but it’s still {@Dallas Renegades@} all the way ",2020-02-09,4,sports_&_gaming,1226563058400681984
1808,"Birds of Prey Is DC s Gayest Movie Yet (Yes, Gayer Than Batman & Robin) {{URL}} (via {@Comic Book Resources@} )",2020-02-09,2,pop_culture,1226564166980337664
1809,Box Office: 8 Reasons ‘Birds Of Prey’ Failed To Take Flight via {@Forbes@} {{URL}},2020-02-09,2,pop_culture,1226564267522043904
1810,"I have never been excited for American football in all of my life (even when my brother played in high school) but after watching the XFL games yesterday, I think I might start taking an interest. {{USERNAME}} ",2020-02-09,4,sports_&_gaming,1226566376086757376
1811,Box Office: ‘Birds of Prey’ Disappoints With $33 Million Debut {{URL}} via {@Variety@} #BoxOffice #BirdsOfPreyMovie #BirdsOfPrey,2020-02-09,2,pop_culture,1226566409284673536
1812,Oklahoma s Parnell Motley dealt with a slight set back with failure to receive invite to NFL Combine.. Motley continue to train hard for Oklahoma s Pro Day set for March.  Top snubs from the NFL scouting combine invite list {{URL}} via {@Draft Wire@},2020-02-09,4,sports_&_gaming,1226593715101347841
1813,Scranton’s Matt McGloin with a TD run and a TD pass in his first three possessions in the XFL.  NY Guardians lead TB 14-0. {@WNEP Sports@},2020-02-09,4,sports_&_gaming,1226593916297863169
1814,Check out what I just added to my closet on Poshmark: Kansas City Chiefs Football Cards - Lot of 3. {{URL}} via {@Poshmark@} #shopmycloset,2020-02-09,4,sports_&_gaming,1226593965203312640
1815,Watching nationwide Sports Twitter (including Baylor #SicEm fans & {@ESPN@} ) rally behind Mike Boynton while questioning the refs in that game has really warmed my  heart. #okstate #WeGetIt. Your move {@Big 12 Conference@} .,2020-02-09,4,sports_&_gaming,1226594515135365121
1816,shoutout to {{USERNAME}} for being literally the only person on this app live tweeting the xfl like it’s game 7 of the finals,2020-02-09,4,sports_&_gaming,1226594568679968775
1817,"The XFL is cool and all, but when are we gonna support/ promote {{USERNAME}} this hard? The WFA has been around since 2009.",2020-02-09,4,sports_&_gaming,1226594961988055040
1818,So {{USERNAME}} and {{USERNAME}} had a big disagreement on Jennifer Lopez. Which Jlo looks better?,2020-02-09,2,pop_culture,1226595847472848899
1819,"Watching the XFL got me thinking why {@Johnny Manziel@} isn’t on my screen rn, come to find out people had my same thoughts for yesterday’s games and my mans had the time ✊",2020-02-09,4,sports_&_gaming,1226595965399977985
1820,Coach GA Magnus calling plays and miked up for the XFL Guardians. He Was the Kutztown O Coordinator. I hope the tv is on tape delay. Lot of f bombs and mother f..ks. Are coming.  {{USERNAME}} {{USERNAME}},2020-02-09,4,sports_&_gaming,1226596141900468225
1821,Kansas City Chiefs Go Shopping For Sneakers With CoolKicks {{URL}} via {@YouTube@} {{USERNAME}},2020-02-09,4,sports_&_gaming,1226623846318559238
1822,I honestly would love to see {@Johnny Manziel@} in the XFL,2020-02-09,4,sports_&_gaming,1226624087872745474
1823,Okay so I saw birds of prey and Mary Winstead can choke me out and I will definitely say thank you {@Birds of Prey@},2020-02-09,2,pop_culture,1226624206403710976
1824,Did anyone else notice the Xbox one controller used in the review booth of the XFL game? Does the X stand for Xbox??? {{USERNAME}} {@Xbox@} #nyguardians #nyguardiansvstbvipers #TBvsNY #XflVipers #XflGuardians,2020-02-09,4,sports_&_gaming,1226624428949360640
1825,"I haven’t watched any of the {{USERNAME}} games but considering the NFL cares this much about player safety, I know it’s probably NFL Blitz 99 out there. ",2020-02-09,4,sports_&_gaming,1226624761972719616
1826,Yo {@BRAXTON MILLER@} the XFL needs you back at QB,2020-02-09,4,sports_&_gaming,1226625387372916736
1827,"Congrats to {@New York Guardians@} for their 1st win in the XFL!!! QB Matt McGloin with a good day, and the defense dominated with the secondary excelling.",2020-02-09,4,sports_&_gaming,1226625728361488392
1828,"Aliquippa/WVU graduate Dravon Askew-Henry with four tackles for NY in the XFL season opener.  Marcelis Branch, an {{USERNAME}} alum, is also in the XFL and had five tackles for Tampa Bay.",2020-02-09,4,sports_&_gaming,1226625891947732992
1829,I wish {@LaMike james@} was playing in the XFL...feel like the dude could still run circles around everybody,2020-02-09,4,sports_&_gaming,1226626554349989888
1830,"Birds of Prey (@ AMC Johnston 16 in Johnston, IA w/ {{USERNAME}} ) {{URL}} ",2020-02-09,2,pop_culture,1226654210911019008
1831,Bob Marley at 75: A Legend in Photos {{URL}} via {@Rolling Stone@},2020-02-09,2,pop_culture,1226655146286907392
1832,The {{USERNAME}} is great to watch ! Really good production and a LOT of cool differences from the NFL.,2020-02-09,4,sports_&_gaming,1226656101954936832
1833,"Oh and BTW, I m pledging my allegiance to {@Dallas Renegades@} for the XFL. #RaisingHell",2020-02-09,4,sports_&_gaming,1226656242627678208
1834,Why can’t the {@Cleveland Browns@} find a consistent FG kicker. I’ve seen like 1 or 2 misses i the XFL games,2020-02-09,4,sports_&_gaming,1226656378892300291
1835,"The best of The Oscars: {@Elton John@} . Congratulations to my favorite singer in the whole world, I LOVE YOU!",2020-02-10,2,pop_culture,1226736137055678469
1836,Jordan Ta’Amu is the best QB in the XFL and that’s facts. #ClearedToEngage {@St Louis BattleHawks@},2020-02-10,4,sports_&_gaming,1226927772955791360
1837,J Lo fans trying to steal an Oscar award just to hand it over to their heartthrob is definitely out of the blue thing to do. #JenniferLopez #Oscar2020 #FanMoment {{URL}} via {{USERNAME}},2020-02-10,2,pop_culture,1226987094125318145
1838,DeAngelo Hall says free agent Chris Harris of the Broncos best fit would be with the Super Bowl Champion Kansas City {@Kansas City Chiefs@} hey Veach I agree! That makes our secondary one of the best in the {@NFL@},2020-02-11,4,sports_&_gaming,1227045476190560256
1839,Follow {{USERNAME}} for the best coverage of the best team in the XFL. #KaKaw!!!!!!,2020-02-11,4,sports_&_gaming,1227131936189095939
1840,Jennifer Lopez Was Too Busy Looking Iconic at an Oscars After-Party to Worry About Her Snub {{URL}} via {@Glamour@},2020-02-11,2,pop_culture,1227281816849133568
1841,"The {@Cleveland Browns@} hired one of the best DC available which he helped {@San Francisco 49ers@} CB {@Richard Sherman@} who would go on to finally to be back to his old self before he ruptured his Achilles which he should’ve been the NFL Comeback Player Of The Year, not the washed QB like {@Ryan Tannehill@} . {{URL}} ",2020-02-11,4,sports_&_gaming,1227290504129384451
1842," The Sharp 600  podcast, ep. 236 {{USERNAME}} gives his thoughts on the XFL and the league s betting potential & welcomes Rohit Ponnaiya ( {{USERNAME}} ) to break down the best bets for the rest of the NBA season.   Subscribe, Rate, & Review!  Listen here: {{URL}} ",2020-02-11,4,sports_&_gaming,1227344808798191616
1843,"Ya ll did {{USERNAME}} dirty and I have nothing but respect for the queen of twitter, thank you.  Gail Simone, an iconic writer of Birds of Prey, loved the film and reckons you might too {{URL}} ",2020-02-12,2,pop_culture,1227437313887625217
1844,I loved the first week of the XFL but one of my favorite things about it was {@Pat McAfee@} . I mean just give him a mic and the man entertains,2020-02-12,4,sports_&_gaming,1227504909052006400
1845,"Ok let’s settle this...  Birds of prey has no redeemable male characters, right!  Well, Get Out has no redeemable white characters, but all race’s went to see it and enjoyed it, it even won Jorden Peele an Oscar!  1/4  #BirdsOfPrey  #DC {@Grace Randolph@} ",2020-02-12,2,pop_culture,1227504918392500225
1846,"Dear {@Houston Astros@} and {@MLB@} ,  I ve loved the Astros since I was 6 years old. In the 30 years since I ve cheered them on in the World Series and through 100 loss seasons, but quite frankly I m sick to death of this scandal. Rooting for the Astros in the 90 s was great... (1/4)",2020-02-12,4,sports_&_gaming,1227622488328298497
1847,Harley Quinn Birds of Prey by Gam3rbarbie!      If this photo makes you happy. Remember to Follow us {{USERNAME}} for more!  #HarleyQuinn… {{URL}},2020-02-13,2,pop_culture,1227923060101132288
1848,". {@Jay Bilas@} on the #Terps/Big Ten:  That was like going from the AFL to the NFL ,and right now, they re in a position to win this league. And the Big Ten is the best conference in the country...You put yourself in the position to win this conference, you re having a fantastic yr. ",2020-02-13,4,sports_&_gaming,1227981501482065921
1849,#tbt #throwbackthursday To the Birds of Prey show we have each summer to conclude our summer reading program! {{USERNAME}} you’re the best! Thanks for everything   {{URL}},2020-02-13,2,pop_culture,1227983110354165763
1850,". {@Peter Schrager@} on Isaiah Simmons:  That guy right there might be the best linebacker to enter the NFL Draft in the last five years. Simmons is a 6-4 monster. 107 tackles last year, 16 TFL and his athletic ability is insane. Don t be surprised if he goes No. 3, 4 or 5.  #GiantsPride",2020-02-13,4,sports_&_gaming,1228012996007518209
1851,Jennifer Lopez in  Hustlers  & More of the Best Pole-Dancing Moments in Music {{URL}} via {@billboard@},2020-02-13,2,pop_culture,1228040106533117954
1852,Happy that it looks like both the {@Dallas Renegades@} and {@Los Angeles Wildcats@} should have their starting QBs in. Week 2 of the XFL is shaping up to be a hoot. More hype than Garage Brawl 4 where someone strapped a taser on a cat so it ran around shocking people. Took out aunt Mary. RIP Mary,2020-02-13,4,sports_&_gaming,1228106306793267200
1853,#HappyValentinesDay!  I’ve got so much for you. {@Justin Bieber@} tickets at 10:20 and 11:25am. And tickets to see The Masked Singer live at 10:40am. {@103 5 KISS FM@},2020-02-14,2,pop_culture,1228346486062276608
1854,So {{USERNAME}} hits on most of what I loved about #BirdsOfPrey in her excellent review: {{URL}},2020-02-14,2,pop_culture,1228376504209375238
1855,I’m so happy that my {@Kansas City Royals@} won the  2015 World Series without cheating!!! The {@Houston Astros@} players & ownership will forever be linked as cheaters for the rest of their careers #2017championshipistainted,2020-02-14,4,sports_&_gaming,1228407398781587461
1856,#BirdsofPrey is exciting and painfully real at times. I am still shocked I loved the film as much as I did. Find out why you should be watching this film {@Bam Smack Pow@} . {{URL}},2020-02-14,2,pop_culture,1228428726460977158
1857,so birds of prey was AMAZING safe to say it’s the best movie I’ve seen in a hot minute. So empowering and honestly a kick in the teeth for misogynistic men who think they control women and their bodies. like. The girl gang were so inspiring and the music was great ( {@h@}  ),2020-02-14,2,pop_culture,1228429089876447232
1858,"So far, I’ve heard quite a few {{USERNAME}} selling points: kick-off rule; shorter games; half-time cam; extra-point rules. Nothing about the football—they’re out there selling side-stories and quirky procedures. I wish ‘em the best, but unless they affiliate w/the {@NFL@} , they will fail.",2020-02-15,4,sports_&_gaming,1228490248939700224
1859,So it’s 69 days until the {@NFL@} Draft & the {@Cleveland Browns@} still don’t have a FO who has has a successful draft. Happy Valentines Day from Maui! Mahalo.,2020-02-15,4,sports_&_gaming,1228564027082600448
1860,Successful second Halloween! Went to see Birds of Prey with the amazing {{USERNAME}} . Thank you alyssasbeautyspace for styling my hair to the best Khaleesi it can be.   I finally found the funkos I was looking for.… {{URL}},2020-02-15,2,pop_culture,1228580147198033920
1861,"Name one sports event you wished you watched in person. I ll start: 2016 {@MLB@} World Series, Game 7. Arguably one of the best {@MLB@} World Series games of the 2010s.",2020-02-15,4,sports_&_gaming,1228591576965738496
1862,Happy valentines Puddins! ❤️  (Can u tell I just saw Birds of Prey) - kornelia_roma - lightworks.society {{USERNAME}} - - - - - - {{USERNAME}} giantscastingshadows  ocwomensmarch santanera_living  #leather #cosplay… {{URL}},2020-02-15,2,pop_culture,1228597901997355009
1863,"Really good piece on {@Birds of Prey@} , went to see it last night and thought it was one of the best films I d seen in a long time. Please go watch it! {{URL}} ",2020-02-15,2,pop_culture,1228645137217183744
1864,The {@DC Defenders@} are the best team in the XFL. What a clinic they put on these last two weeks.,2020-02-15,4,sports_&_gaming,1228798402466648070
1865,". {@Southeastern Conference@} There are over 28 fouls in the 1st half of Tennessee-South Carolina! Would you please address your the refs you hire to cover this conference? I know u don’t have our own but you’re paying them. If we are the best conference, act like it and pay for appropriate officials.",2020-02-15,4,sports_&_gaming,1228830310193909760
1866,Fiction in the time of fake news Arundhati Roy on the sad state of affairs Kashmir and Modi s India! {{URL}} via {@The Caravan@},2020-02-16,2,pop_culture,1228851537557979138
1867,Kaash Paige - Love Songs (Lyrics) {{URL}} via {@YouTube@} #Dubai #AbuDhabi #Amman #Kuwait #Muscat #Doha #London #Lahore #Islamabad #mydubai I m the Queen of Love...I m all about Love Songs!,2020-02-16,2,pop_culture,1228855211957063686
1868,Happy valentines day❤ {{URL}} via {{USERNAME}} #images,2020-02-16,3,daily_life,1228857624684351488
1869,I am so glad that Cassie finally said yes to her {{USERNAME}} dress! #SYTTD,2020-02-16,2,pop_culture,1228858614636519424
1870,"I hope everyone enjoyed Valentine s Day! Also, happy 15th {@YouTube@} !",2020-02-16,3,daily_life,1228859142976266242
1871,"Kabir Singh didn’t won any filmfare award, I mean are you seriously kidding me? No wonders why India will never win an Oscar. HYPOCRITES!! {@Shahid Kapoor@} {@Sandeep Reddy Vanga@} #kabirsingh #Filmfare #Filmfare2020 #FilmfareAwards2020 #",2020-02-16,2,pop_culture,1228884295948746752
1872,The latest The Internet privacy Daily! {{URL}} Thanks to {{USERNAME}} {{USERNAME}} {{USERNAME}} #gdpr #permissions,2020-02-16,5,science_&_technology,1228885491132571654
1873,"Sometimes, its not about being together its about being there for each other. Happy Valentines Day.  KIANO YoungLoveOnIWANT {{USERNAME}} {{USERNAME}} {{USERNAME}} {{USERNAME}} ",2020-02-16,3,daily_life,1228887716739342342
1874,"Love is the happiness of today, and promise of tomorrow, so this warm note comes to U, to say that you must live life with a heart full of love, Happy Valentines Day my love!  KIANO YoungLoveOnIWANT {{USERNAME}} {{USERNAME}} {{USERNAME}} {{USERNAME}} ",2020-02-16,3,daily_life,1228888330554793984
1875,Sad love songs that s my {@Toni Braxton@} I wanna hear,2020-02-16,2,pop_culture,1228889781704298496
1876,Another fantastic update byjodipicoult: Happy Valentines Day to all the Delilahs spending time with a book boyfriend. #princeoliver btlmusical {{USERNAME}} … {{URL}},2020-02-16,3,daily_life,1228914645831999488
1877,Delusional {{USERNAME}} thinks Lou Lamoriello is doing a great job despite the fact that LOSER Lou hasnt made a trade since July 2018. Very sad when the NHL establishment tries to push FAKE NEWS on such passionate #isles fans.,2020-02-16,4,sports_&_gaming,1228915697255931911
1878,The internet: Put me in a MrBeast video - Sign the Petition! {{URL}} via {@Change org@},2020-02-16,2,pop_culture,1228915893490659328
1879,Happy Valentines Day everyone! Dross showed out this year. Love you king! {{USERNAME}},2020-02-16,3,daily_life,1228916374958956545
1880,The Internet Wants Issa Rae and John Cho to Host the 2020 Oscars {{URL}} {{USERNAME}},2020-02-16,2,pop_culture,1228916527652462596
1881,I m watching miles derp with some people he met on the internet. Come check it out here: {{URL}} via {@Mixer@},2020-02-16,3,daily_life,1228920727908171779
1882,"I really don t understand why #Midsommar was not in the running for an Oscar. A great horror/suspense flick I ve watched in a long time, probably the last I saw was #Tumbbad. It s a beautifully shot movie about loneliness. Thankyou {@Ari Aster@} ! WATCH NOW.",2020-02-16,2,pop_culture,1228944193491492875
1883,#1 Inspirational Station On The Internet Ver na Jones {{USERNAME}} - Uncoditional Promo - Visit: {{URL}} Listen online at {{URL}},2020-02-16,2,pop_culture,1228945101608620033
1884,Sorry I m late but she s awesome so follow and check the link ⬇️⬇️    {{USERNAME}} Join FREE today only!!  Come have fun with me on my fan page! You DO NOT want to miss this. Happy Valentines Day! … {{URL}},2020-02-16,3,daily_life,1228945465007312896
1885,Aw man. It looks like {{USERNAME}} disappeared off of the internet again.,2020-02-16,3,daily_life,1228948350977921024
1886,The same people crying about {@KING 810@} ’s back drop are the same people who can’t stand you having an opinion outside of theirs on the internet.,2020-02-16,2,pop_culture,1228950041735389185
1887," ask-peach-kisses: “HAPPY VALENTINE’S DAY!” - From the resident ocs of this (and {{USERNAME}} -sokku-sweets‘ blog!) [HELLO LOVES! This took me awhile to do, and forgive me for sped lookin stuff here, its a lot of ocs for this years Valentine’s Day... {{URL}} ",2020-02-16,3,daily_life,1228965797437022209
1888,"Happy Valentine s Day, Gloria {{URL}} via {{USERNAME}} ",2020-02-16,3,daily_life,1228969188133343232
1889,#1 Inspirational Station On The Internet YRM (Your Righteous Mind) by {@Donald Lawrence@} Listen online at {{URL}},2020-02-16,2,pop_culture,1228973961494454273
1890,The replies on the {@BBC Sport@} account are always the pit of the internet.,2020-02-16,4,sports_&_gaming,1228998042499637248
1891,"Joaquin Phoenix joins animal activists, lawmakers to announce bill to ban wild animal acts in California {{URL}} via {@ABC7 Eyewitness News@} ",2020-02-16,2,pop_culture,1228998721746108416
1892,"Facebook might be the biggest propaganda machine. First it affected US and European politics and now affecting Indian politics heavily for past few years with all the fake news and propaganda. You   know what s happening on your platform, right? {@Facebook@} ",2020-02-16,5,science_&_technology,1229001047969918976
1893,"Dear young people, do not bury your talents, the gifts that God has given you! Do not be afraid to dream of great things! {{USERNAME}} #KISSESaDAIGdigNiOCEANA",2020-02-16,3,daily_life,1229004281723809792
