,text,date,label,label_name,id
2581,Desert Hawks?   Gila Monsters?   Rattlers?  An inside look at the naming and logo design processes for the NHL’s Las Vegas franchise — including some names that didn’t quite make the cut. | {@Jesse Granger@} {{URL}},2020-04-29,4,sports_&_gaming,1255586707342331905
2582,#NewMusicFriday {{USERNAME}} {{USERNAME}} @partyfavormusic {{USERNAME}} {@Duke Jones@} {{USERNAME}} {{USERNAME}} {{USERNAME}} {{USERNAME}} {{USERNAME}} {{USERNAME}} {@Blanke@} {@Malaa@} {{USERNAME}} @V_nss_A {@J Worra@} {{USERNAME}} &More! {{URL}},2020-05-01,2,pop_culture,1256251838376091653
2583,Everyone in my family works for {@SoCalGas@}  ‍♂️‍♂️ we built our wealth on the backs of fracking. Does me driving an electric car make up for it?,2020-05-02,1,business_&_entrepreneurs,1256460961067614209
2584,Pau Gasol Continues Honouring His Friendship with Kobe Bryant By Looking After Vanessa Bryant and Family Post His Death {{URL}} via {{USERNAME}},2020-05-02,2,pop_culture,1256583309427171329
2585,"I need to see {@Taika Waititi@} sit down with our man {{USERNAME}} for a passionate korero. Would love to hear about his journey in a more relaxed interview setting. Favourite grassroots chat show, with favourite home grown film director, being asked what his favourite bakery is. xD",2020-05-03,2,pop_culture,1256793148170231808
2586,Filmmaker Jailed Over Music Video That Mocked Egypt s Presid..  WSJ - News - Noticia - Bitcoin - CryptoCurrency - Forex - {{USERNAME}} > {{URL}},2020-05-03,2,pop_culture,1256793990051045382
2587,I can’t believe I really have a whole degree. I worked so hard for the past 4 years to have a BSW behind my name. Life is crazy. Feeling so blessed. Thank you {@SpaceU@} and {{USERNAME}} for giving me a place to discover my true passion.,2020-05-03,3,daily_life,1256794963188289537
2588,Dear sir/Mam I order for refill my indane gas  cylinder and I made the payment online after 2 day my booking is cancelled even I didn t cancelled it Plz help and take a strict action for the same Order No-2-000359417960 Invoice No-5-100384132673 Bank Ref-012210670637 {{USERNAME}},2020-05-03,3,daily_life,1256823089674874880
2589,Shaka set to return on ‘The Queen’ {{URL}} via {{USERNAME}} African Soapies,2020-05-03,2,pop_culture,1256823152648302593
2590,on {@YouTube@} : KSI – Houdini (feat. Swarmz & Tion Wayne) [Official Music Video] {{URL}},2020-05-03,2,pop_culture,1256823638206144512
2591,CRAAAAAAAAAAAAAAAAAAAAAAAAAAAAAAAAAAAAAAAAAAAAP  HE S GONNA SELF DESTRUCT!!!!!!!!!!!!!!!!!!!!!!!!!!!  .....  NOW THE ENDING MAKES SENSE!!!!! THAT WAS THE DEVIL TALKING TO ASTA!!! ....the uestion is.....  what was he Telling him?  #Toonami #BlackClover {{USERNAME}} {{USERNAME}},2020-05-03,2,pop_culture,1256825040902946816
2592,The latest Gwadar Oil and Gas! {{URL}} Thanks to {{USERNAME}} #gwadar #hollywood,2020-05-03,5,science_&_technology,1256852394979348481
2593,"Morning to #Odatribz  Thank you for the support  Pls continue streaming and may God bless each and every one of you, I am grateful.    Enjoy Egungunbe careful #egungunrapversion {{URL}} @IceFlows",2020-05-03,2,pop_culture,1256853070992084992
2594,NSG - Ourself [Music Video] | GRM Daily {{URL}} via {@YouTube@} #,2020-05-03,2,pop_culture,1256853745943576577
2595,". {@Hilltop Hoods@} {{USERNAME}} Hilltop Hoods have written a song from, and about isolation titled  I m Good , with proceeds from the track going to the Support Act ‘Roadies (Crew) Fund’, get behind it... {{URL}} ",2020-05-03,2,pop_culture,1256854054019325952
2596,Vomac Radio is the place to be EVERY SATURDAY NIGHTTT {{USERNAME}},2020-05-03,2,pop_culture,1256854726529949696
2597,Phil Collins - Another Day In Paradise (Official Music Video) {{URL}} via {@YouTube@} GENIOOOOOOOOOOOOOOOOOOOOOOOOOOOO.,2020-05-03,2,pop_culture,1256882281253343233
2598,"Sunday emails so far, {@easyJet@} offering me a cheap holiday to Turkey {@Betfair@} offering to match my £10 bet & 50 odd from a Nigerian uncle I never knew I had",2020-05-03,3,daily_life,1256882312425373697
2599,NEW DAY NEW WORLD #thespoons music video for positive mental health during COVID to #CoreyHartNow  (Corey rocked!) #janesiberry #ImagesInVogue #aFlockSeagulls #PeetandReet #yourtvniagara {@Richard Crouse@} These folks rocked it! Watch video: {{URL}},2020-05-03,2,pop_culture,1256882652381974530
2600,Greece Green - 4pm in Calabasas freestyle (Official Music Video) {{URL}} via {@YouTube@} Check it out word to {@Drizzy@},2020-05-03,2,pop_culture,1256882773131853824
2601,showmore - now (feat. SIRUP) (Official Music Video) {{URL}} {@YouTube@} より,2020-05-03,2,pop_culture,1256883105157111808
2602,{{URL}} I came across this on youtube and since then it has stuck in.  Please tell me who has sung this version? {@Gillette India@} {@Gillette@} #ShavingStereotypes,2020-05-03,2,pop_culture,1256883636751736834
2603,Finishing an hour of rising English bands with {{USERNAME}} {{USERNAME}} and now {{USERNAME}}  Raise Your Glass  - Scottish bands hour follows at 1pm Up next its {{USERNAME}} hr - a phone interview with Barry from deepest isolation in far flung Sussex {{URL}},2020-05-03,2,pop_culture,1256885510393475072
2604,Motives - Reap and Sow (Official Music Video) {{URL}} {@YouTube@} より,2020-05-03,2,pop_culture,1256886070840455168
2605,"MORNING HAS BROKEN - Cat Stevens (Lyrics) {{URL}} via {@YouTube@} She s the Queen church-go-ers  May a man never beat you, or we ll get  em!",2020-05-03,2,pop_culture,1256886189711228930
2606,"SO UNTIL THE END OF THE PROMOTION, LIM JAEBEOM AND BAMBAM STILL DIDNT GET THE ENDING FAIRY THEY DESERVE WHILE THEY ARE ALWAYS BE THE TOP TWO MOST VIEWED SOLO CAM AMONG THE OTHERS. THEY DONT DESERVE THIS. IM JUST SAYING. {@GOT7@} #GOT7 #JB #Jaebeom #제이비 #재범 #갓세븐 #KPOP",2020-05-03,2,pop_culture,1256913578990268417
2607,"Friends, thank you so much for your love for my fundraiser for {@American Foundation for Suicide Prevention@} . Overwhelmed by the support you have shown by donating and sharing. If you would to help the link is below. Thank you all once again. I truly love you all.#ReleaseTheSnyderCut ❤️ {{URL}} ",2020-05-03,3,daily_life,1256914130142986242
2608,"New music video “FINAL CALL” now available on YouTube. Shot by {{USERNAME}} Link in bio @ Dallas, Texas {{URL}} ",2020-05-03,2,pop_culture,1256914841681432576
2609,"PAM - Justin Quiles, Daddy Yankee, El Alfa (Official Music Video) {{URL}} via {@YouTube Music@} ",2020-05-03,2,pop_culture,1256915788608483328
2610,Spades da King x $tratos$ x RoseJay x cameo ShowNtellXXX DJ Chef 32nist & Jwritezz  Only Way Up Official Music Video Tonight at midnight amazonfiretv Vero G Spotlight TV App Produced x Directed {{USERNAME}} … {{URL}},2020-05-03,2,pop_culture,1256915994133647362
2611,#YourFavoriteTexasPromoter #BornPaidEnt️️️ NEW MUSIC VIDEO BY MY BROTHER bornpaidzeezy - #untold shot by {{USERNAME}}  #4E #hoodfame #OakCliffAmerica #BornPaidWorldWide #DallasWallStreet #ripfresh #bp5l… {{URL}},2020-05-03,2,pop_culture,1256944602575142912
2612,Camila Cabello Offers the Chance to Be in Her Next Music Video for All-In Challenge {{URL}} via {@billboard@},2020-05-03,2,pop_culture,1256944612423299072
2613,Check out new work on my {@Behance@} profile:  Zurana - Official Music Video | Kryso & Sun | Zeeshan K  {{URL}},2020-05-03,2,pop_culture,1256945423937224706
2614,"A quick update from Rob Andringa and a sampling of the support the former {@Wisconsin Hockey@} player has received from teammates, friends and the hockey community (and beyond): {{URL}} ",2020-05-03,4,sports_&_gaming,1256945588110856192
2615,““Part of Me” ⁦ {{USERNAME}} ⁩ Releases Official Music Video” by {{USERNAME}} {{URL}},2020-05-03,2,pop_culture,1256975289558560771
2616,I m going to watch Halftime report Monday just so I can hear {@Scott Wapner@} explain how he realized on the weekend the economy is in bad shape.,2020-05-03,1,business_&_entrepreneurs,1256975483247435779
2617,Kap G - I See You ft. Chris Brown [Music Video] {{URL}} via {@YouTube@} {@KAP G@},2020-05-03,2,pop_culture,1256975996542234624
2618,#아스트로 #ASTRO #GATEWAY #Knock #널찾아가 #ASTRO_GATEWAY_OPEN {@ASTRO@} So the fact that I’m me and no one else is one of my greatest assets. Emotional hurt is the price a person has to pay in order to be independent.,2020-05-03,3,daily_life,1256976397555269632
2619,Dear {@Dr Pepper@} {@The Coca Cola Co@} a friend of mine just said that she was told that #DrPepper is no longer being manufactured and that the stores are not sure when they ll have more. Please tell me it s not true. #news #infoneeded,2020-05-03,1,business_&_entrepreneurs,1257005062364119040
2620,Madonna - Nothing Really Matters (Official Music Video) {{URL}} via {@YouTube@} MATRE,2020-05-03,2,pop_culture,1257006087250890757
2621,i still wanna know if aaron’s gonna be dancing w you in this music video. i need to prepare myself {@Ariana Grande@},2020-05-03,2,pop_culture,1257006426943303682
2622,SOULFLY - Back To The Primitive (OFFICIAL MUSIC VIDEO) {{URL}} via {@YouTube@} a {@Jesse Ventura@} campaign will coincide with the resurrection of #numetal #GoGreen #GreenEnter #enterthegreen,2020-05-03,2,pop_culture,1257006764349947907
2623,NIGERIAN OIL AND GAS INDUSTRY LOCAL CONTENT ACT – A ROADMAP FOR AFRICA’S RESOURCE RICH COUNTRIES {{URL}} via {@The Labour Party@} 24,2020-05-03,1,business_&_entrepreneurs,1257036124469559297
2624,Frailboys - Love Less Than Money (official music video) {{URL}} via {@YouTube@} {{USERNAME}} {{USERNAME}},2020-05-03,2,pop_culture,1257036642403090438
2625,The Communards - For A Friend (OFFICIAL MUSIC VIDEO) {{URL}} via {@YouTube@} How apt at the moment. An underrated classic {@Richard Coles@},2020-05-03,2,pop_culture,1257036650779037696
2626,Still waiting for {@Drizzy@} to make the Outro to “9” a full song,2020-05-03,2,pop_culture,1257037106213457921
2627,I just earned the  God Save the Queen  (Level 34)  badge on {{USERNAME}} ! {{URL}},2020-05-03,4,sports_&_gaming,1257065577987944448
2628,Up next on my  go follow now  list is {{USERNAME}} Come on twitter stop leaving these guys in the dark.,2020-05-03,2,pop_culture,1257065655427162112
2629,"Y’all boy pray for me, ain’t nothing wrong my gas tank a bit pass E and I’m trying to get to a {@GetUpside@} gas station. ",2020-05-03,3,daily_life,1257066528182349825
2630,Dee Koala - 4 The Khaltsha (Official Music Video) ft. Lookatups {{URL}} via   @ChaeYunEun  @DeeKoala1,2020-05-03,2,pop_culture,1257067083160080387
2631,"Fun end to the weekend with a float trip. Greyson and Asher were completely exhausted afterwards, but still thrilled to see Caroline when they got home. {{USERNAME}} {{URL}} ",2020-05-03,3,daily_life,1257096810197377025
2632,I used a gas station to finally hear Half Of My Heart by {@John Mayer@} {{URL}},2020-05-03,2,pop_culture,1257097267317665793
2633,I am excited for PlayStation fans like {{USERNAME}} that have been waiting for The Last of Us 2 but honestly happy I saw the spoilers and know what I am  missing  out on.,2020-05-04,4,sports_&_gaming,1257368598047330304
2634,"I started watching New Girl over the weekend. I was watching an episode when {@Rachael Harris@} suddenly appeared, and I looked at my mom and went  She s from Lucifer!! ",2020-05-04,2,pop_culture,1257429127256256514
2635,Pag-Ibig Fortune Cookie - MNL48 (Music Video) {{URL}} via #HappyEckaDay #OurHappinessEcka || {@MNL48@},2020-05-05,2,pop_culture,1257517456655966208
2636,"Hi {{USERNAME}} love your app, but don’t love the fact you’ve just taken £48 out of my bank account when I haven’t signed up for ‘all three packs’?",2020-05-05,5,science_&_technology,1257610393951895552
2637,"Sooo, this may be an unpopular opinion, but I just discovered {@Rice A Roni and Pasta Roni@} and I m pissed off that for 35 years I never knew about this before! I need new friends to tell me about this stuff!! I have fake friends… {{URL}} ",2020-05-05,3,daily_life,1257822121792864256
2638,"Sister Loraine Marie Maguire, a mother provincial of the Little Sisters of the Poor:  We cannot hold the hands of the dying elderly while at the same time facilitating the ending of pre-born life. Our faith will not allow it.  #LetThemServe {@Fox News@} {{URL}} ",2020-05-06,3,daily_life,1257971315044159488
2639,Still waiting for {{USERNAME}} and my other friend to play ACNH. So far I have two friends who I personally asked to visit my island,2020-05-06,4,sports_&_gaming,1258033662555086850
2640,I’ve been obsessed with {@Garcelle Beauvais@} since the premiere but seeing her in mommy mode just made me love her so much more. She is just everything. Hair to stilettos to heart to character. New favorite HW from the whole franchise. THE QUEEN.  #RHOBH,2020-05-07,2,pop_culture,1258214580024680451
2641,OMG I hope I didn’t miss it but HAPPY MF NURSES DAY/WEEK {{USERNAME}} the BADDEST one in the game (nursing field),2020-05-07,4,sports_&_gaming,1258244220646612992
2642,100 million views in 24 hours for the music video produce by gcf directed by jungkook {@BTS_twt@},2020-05-07,2,pop_culture,1258363835162882051
2643,hi {@TessAHHH@} can u please tell my friend that hes being a bully  hes spamming me with  vic  and haunting me it s not fair pls,2020-05-07,3,daily_life,1258456559056752641
2644,"Dear {@Alexa@} , Please tell your programmers to program you so that alarms can be named. Having multiple alarms go off without having names is confusing and kinda  worthless. If I can name a timer, I should absolutely be able to name an alarm. Your friend, KWH",2020-05-07,5,science_&_technology,1258516014129532928
2645,"Yo thank you {{USERNAME}} for this huge bag! It’s perfect for all my orders !  Thanks everyone for the support!  (This is a older video) I’m shipping every order out this week tho love you guys @ New York, New York {{URL}} ",2020-05-07,1,business_&_entrepreneurs,1258516263074029568
2646,2 hours  i think ima fall tf out im so happy #JCYW2 {@THE VOICE@},2020-05-08,2,pop_culture,1258575729543045120
2647,. {@6ix9ine@}  s music video for  GOOBA  received almost 40 million views in the first 24 hours of release.,2020-05-09,2,pop_culture,1259210858183483392
2648,⁦ {@Barack Obama@} How dare you criticize ⁦ {{USERNAME}} when more⁩ people in the United States died of H1N1 and Ebola under your watch. Less people are dying from Coronavirus under President Trump’s watch. You’re such a hypocrite. {{URL}},2020-05-10,2,pop_culture,1259298935505592321
2649,Drinks absolute Sister drinks tequila ... 15mins later.. Me to my sister: You ain’t hot?   Sister: yeah I hott Simultaneously laughs at each other!   @Nikieva_Wallace,2020-05-10,3,daily_life,1259299330126725120
2650,So proud that {@Jason Kenney@} and his gang are reopening Alberta just in time -- kaff kaff. Spread the word that Alberta is number one for all your #covid19 #covid19AB needs. {{URL}} #yyc #yeg #ableg #abpoli #brooks #cargill #werenumberone,2020-05-10,3,daily_life,1259299950464077825
2651,UFC 249 PPV starts in minutes!! Life is good!! {@UFC@} #ufc249,2020-05-10,4,sports_&_gaming,1259301446710779905
2652,UFC 249 has a stacked card! Here we go! {@UFC@},2020-05-10,4,sports_&_gaming,1259301900698222593
2653,UFC 249 Results: Francis Ngannou Knocksout Jairzinho Rozenstruik (Highlights) {{URL}} #FrancisNgannou #JairzinhoRozenstruik #UFC249 via {@MiddleEasy@},2020-05-10,4,sports_&_gaming,1259329259182702592
2654,Chris Brown Jr. {{USERNAME}} Happy Glo hope your day was blessed,2020-05-10,2,pop_culture,1259330328704901120
2655,#NowPlaying  Sweet Love  by Chris Brown on {@TIDAL@} {{URL}},2020-05-10,2,pop_culture,1259358728337358849
2656,"Details about UFC 249: Ferguson vs. Gaethje including fighter profiles, schedule, and where to watch. {{URL}} via {@ESPN@} App {{URL}} ",2020-05-10,4,sports_&_gaming,1259359040196542464
2657,Pros React To Justin Gaethje Upset Tony Ferguson To Win Interim Tilte At UFC 249 {{URL}} #justingaethje #MMA #MMAnews #TonyFerguson #UFC #UFC249 via {@MiddleEasy@},2020-05-10,4,sports_&_gaming,1259359559514296322
2658,"I see {{USERNAME}} , the President of the United States of America, spent his Saturday watching TV during a national crisis.",2020-05-10,3,daily_life,1259360779209453568
2659,"Happy Mother’s Day to all super moms out there especially to my mother! You’re the best, ILY!❤️❤️  ILYMa from SB19xA Tin {@SB19 Official@} #SB19",2020-05-10,3,daily_life,1259361155254038529
2660,"Happy Mother s day to all the mama s out there, especially to my sissy {{USERNAME}} and please don t forget that iloveyou so much and i m always here for you no matter what.. Mwaaaah..❤",2020-05-10,3,daily_life,1259361280554496007
2661,"Happy Mommy’s Day to all you Queens out there, especially to our Queen here whom {{USERNAME}} and I have to now pay back her years of thankless child-rearing as her official photographers (and editors). Thank you… {{URL}} ",2020-05-10,3,daily_life,1259361743224147973
2662,"Had a lovely MD. Happy to have my husband home for it, and to be able to chat with my mum and sister in WA online. Missing my SIL - we were supposed to watch our kids grow up together. Have donated to both her foundation and {@Ovarian Cancer Aust@} in her honour this #mothersday2020",2020-05-10,3,daily_life,1259390156261298176
2663,Blessed day. {{USERNAME}} Sister Eunice Njeri,2020-05-10,3,daily_life,1259390174309634056
2664,Happy Mother’s Day to my beautiful sister {{USERNAME}} thank you for blessing me with a nephew ♥️,2020-05-10,3,daily_life,1259390851672756224
2665,"Hi {@Air India@} , my parents (in Mumbai) need to travel to New York ASAP because of my sister s pregnancy. They ve been contacting the helpline to book 2 tickets on the special flight to EWR but haven t gotten through. Could you tell us how to proceed?",2020-05-10,3,daily_life,1259391247187357697
2666,Happy Mother’s Day to my sister {{USERNAME}} ❤️❤️. Chunks got a whole support system and I love seein you post her. Keep being a great mom. Love you,2020-05-10,3,daily_life,1259392200535834630
2667,"UFC 249 results: Bryce Mitchell puts on grappling clinic, dominates Charles Rosa | MMA Junkie via {@MMA Junkie@} {{URL}} ",2020-05-10,4,sports_&_gaming,1259417215293460480
2668,"So, we have this empty vase with lights in it on our dining table. I accidentally tapped it with my knife and it made a ‘ding’ noise. My sister’s reaction was to say “dinner is served!” But you can tell I watch too much {{USERNAME}} because I said “top of morning!” ‍♀️",2020-05-10,3,daily_life,1259419050221985792
2669,#mothers_day Let s respect women they are our mothers they gave us life without them we nothing I couldn t be here without them you have my bless all the women out there all the mothers out there @mathiasiyaloo A… {{URL}},2020-05-10,3,daily_life,1259419191842607104
2670,A single day can t define a Mother. Every day is a Mother s day for me.  Can t imagine life without Maa.  Happy Mother s Day {@anand mahindra@},2020-05-10,3,daily_life,1259420141160284160
2671,Parasitism of Adult Pentatomidae by Tachinidae in Soybean in the North Central Region of the United States {{URL}} JISci {{USERNAME}},2020-05-10,5,science_&_technology,1259420928682815488
2672,"Happy Mother’s Day #MamaBae hendrinakhanyile My number one fan, loudest cheerleader, therapist, fun-maker and one of the hardest workers I know!  Thank you for making me and my sister {{USERNAME}} I literally wouldn’t… {{URL}} ",2020-05-10,3,daily_life,1259421554657693697
2673,A mother is always the beginning. She is how things begin. Happy Mother s Day!  Still can t imagine a life without you mom rakshameehnia... I m sure {{USERNAME}} agrees . . . #meehnia #mother #mothersday #mommy… {{URL}},2020-05-10,3,daily_life,1259421932363153408
2674,Awesome fights on the ufc 249 card today! {@Bryce Mitchell@} who is next for you ? Time to jump up a level in competition now that your getting camo,2020-05-10,4,sports_&_gaming,1259422576763269125
2675,“I’m Not Happy With The Stoppage”- Dominick Cruz on Getting Knocked Out by Henry Cejudo - Essentially Sports {{URL}} via {@Google News@},2020-05-10,4,sports_&_gaming,1259451873255395328
2676,Anyone who doesn t think the legend of {@Tony Ferguson@} grew bigger at UFC 249 is a casual to say the least,2020-05-10,4,sports_&_gaming,1259452307936329729
2677,"Estimating The Infection Fatality Rate Among Symptomatic COVID-19 Cases In The United States. I’m interested to see mortality in subgroups, data on disparities {@AMA@} {@ACP@} {{USERNAME}} ",2020-05-10,3,daily_life,1259452394632630273
2678,#SharonNicholas {{USERNAME}} #Wellness Journey  Event & #Wedding #Designer #PaperFlorals #Artist  #GraphicDesigner  Collaborate #Author  United States {{URL}},2020-05-10,1,business_&_entrepreneurs,1259480091777695745
2679,Happy mothers day to all the beautiful and lovely mothers out there especially to my Mother of my life may the gud lord Continue to Bless u and give u more life.Blessed love. {{USERNAME}},2020-05-10,3,daily_life,1259480315824934917
2680,Happy Mother s day to these beautiful ladies! Real mothers in this world! Enjoy your special day! {{USERNAME}} {{USERNAME}} {{USERNAME}} {{USERNAME}} {{USERNAME}} {{USERNAME}} !,2020-05-10,3,daily_life,1259482107417485314
2681,"Happy 1st Mother’s Day to my sister. Thank you for making me a God Mother, I love you and Nasir long time ♥️ {{USERNAME}} ",2020-05-10,3,daily_life,1259482665960574976
2682,"Happy Mother s Day to all the mothers out there! Especially to your mom, {{USERNAME}} #MicoleDy",2020-05-10,3,daily_life,1259482673975660544
2683,"Happy mother s day to my sister {{USERNAME}} , Payten is yo clone fr I wouldn t have wanted it any other way",2020-05-10,3,daily_life,1259483072376029184
2684,"Happy Mother’s Day to my fellow female Evergreen Coaches and to all the great mothers out there juggling crazy schedules!! It’s a lot of work, but so worth it!!!!♥️ {{USERNAME}} {{USERNAME}} ",2020-05-10,3,daily_life,1259510179936317440
2685,Happy Mother’s Day to my twin sister and brilliant Mom {{USERNAME}} in NYC ❤️,2020-05-10,3,daily_life,1259511119523319809
2686,"According to the {@American Gaming Association@} Association there are 17 casinos open in the United States, including 11 commercial in Deadwood, SD, and six Native American properties (3 OK, 2 WA, 1 ID). The other 972 remain closed.",2020-05-10,4,sports_&_gaming,1259511510511972355
2687,"Happy 1st Mother’s Day to my sister {{USERNAME}} I love you mama, happy baby Adrian finally met the world. You’re gonna be such an amazing mommy & I can’t wait to meet my lil nephew ILOVEYOU!!",2020-05-10,3,daily_life,1259512796527681537
2688,"Happy Mother’s Day to all the TERRIFIC MOMS out there, especially our tennis moms and stepmoms!   YOU ROCK! {{USERNAME}} ",2020-05-10,3,daily_life,1259541393736978432
2689,Signifyd is among {{USERNAME}} & {{USERNAME}} Best Places to Work for the fifth year in a row. Find out why. {{URL}} #BayAreaBPTW,2020-05-10,1,business_&_entrepreneurs,1259541465945997316
2690,"Shoutout to my sister friend lover girl {{USERNAME}} she’s definitely a day one stay by your side, genuine person, genuine Taurus and like the greatest thing ever! ❤️ it’s Mother’s Day &she was there when I had my first child! I wish you many blessings and great thing this year!",2020-05-10,3,daily_life,1259541959842111490
2691,"Happy first Mother’s Day to my sister! She’s such a good mom  ❤️❤️ proud of you sis, now make more {{USERNAME}} ",2020-05-10,3,daily_life,1259542374612635648
2692,Hilarious moment little boy and sister shave head with electric razor {{URL}} via {@Daily Mail Online@} {{USERNAME}} Hope you find it Chris,2020-05-10,3,daily_life,1259542385744281605
2693,Happy Mother’s Day! Truly the most important of jobs! Blessed to have such a great mother myself and very proud to have the absolute BEST mom raising our boys! #love #HappyMothersDay {{USERNAME}},2020-05-10,3,daily_life,1259543490675048449
2694,"The mad world of UFC 249: No fans, fighters hearing pundits ..  MailOnline - Coronavirus - News - Noticias - Bitcoin - CryptoCurrency - Forex - {{USERNAME}} > {{URL}} ",2020-05-10,4,sports_&_gaming,1259570924640223235
2695,"Happy Mother’s Day to three angels that God blessed me with since the day I was born. My mother msfraz23, my sister {{USERNAME}} , and my grandmother, three of the best to ever do this moms thing! Love y’all and… {{URL}} ",2020-05-10,3,daily_life,1259571475436253185
2696,Happy Mother’s Day to my lil sister {{USERNAME}} love you girl,2020-05-10,3,daily_life,1259598968302063616
2697,Happy Mother’s Day to all the mommas out there - especially the ones committed to matching with their littles  {{USERNAME}} #Bodenbyme {{URL}} #liketkit {{URL}} {{URL}},2020-05-10,3,daily_life,1259599610152210432
2698,UFC 249 was a success so will boxing be back soon? {{URL}} via {@WordPress com@} #boxing #UFC249 #lockdown,2020-05-10,4,sports_&_gaming,1259601750140555265
2699,So {{USERNAME}} put my little sister on Trina and she been using my speaker since hers is busted and......,2020-05-10,3,daily_life,1259602352622972928
2700,"Kara is in year one. Apart from concern about her health, we cannot risk her going into the general population and bringing Covid-19 home and infecting us. Who would look after her, and her sister, if we got sick, or worse? This isn t a game.  Well, {@Boris Johnson@} ?",2020-05-10,3,daily_life,1259602674858803200
2701,"UFC 249 results: Francis Ngannou scores highlight-reel KO, floors Jairzinho Rozenstruik in 20 seconds {@MMA Junkie@} {{URL}} ",2020-05-10,4,sports_&_gaming,1259602912306532352
2702,brooke wouldn’t finish her cole slaw because it was “spicy”  my sister is That White Person {{USERNAME}},2020-05-10,3,daily_life,1259603290351964161
2703,"UFC 249 results: Henry Cejudo finishes Dominick Cruz, then retires {@MMA Junkie@} {{URL}} ",2020-05-10,4,sports_&_gaming,1259603474062270468
