,text,date,label,label_name,id
933,"Fight Night #wildervsortiz2 #boxing {@World Boxing Council@} My scorecards will focus on punches thrown on back of the Head, these Judges & Refs need VAR because they Obviously don t see REPETITIVE action on REAL Time. ️ #ProtectYourselfatallTimes ‍♂️",2019-11-24,4,sports_&_gaming,1198417363336646656
934,Time for the main event {@Adam Cole@} {@Roderick Strong@} {@Kyle O Reilly@} {@Bobby Fish@} #UndisputedEra vs #TeamCiampa {@BLACKHEART@} {@Insidious Lee@} {{USERNAME}} #WarGames,2019-11-24,4,sports_&_gaming,1198418172346396673
935,The Chargers lead the Lobos 10-7 at halftime! We should have an exciting second half ahead of us! {@NFHS@} #AZPreps365,2019-11-24,4,sports_&_gaming,1198419988425478146
936,"Four parts of the Minneapolis rap collective {@DOOMTREE@} formed this beast named {{USERNAME}} , and they blew the doors off {{USERNAME}} in Denver last night.  Their new album “Great Hits” is out now! {{USERNAME}} … {{URL}} ",2019-11-24,2,pop_culture,1198440110175457281
937,Y’all my mom got me Harry Styles tickets!!!! I have the best mom ever honestly {@Harry Styles@} I will see you in August,2019-11-24,2,pop_culture,1198440542281043968
938,"So, normally {@Reby Hardy@} I d tease you about how the Bears are gonna woop the Giants tomorrow. However, I don t have that kind of confidence in my team. So, instead I m just going to surrender. Bears offense is embearassing. Your defense should have a day tomorrow.",2019-11-24,4,sports_&_gaming,1198440671633428482
939,"Reflecting on the Main Event of #NXTTakeOver I am now SADLY Reminded that 7/8 of the MAIN EVENT came through ROH... I MISS THAT Now, Especially with EVERYTHING {{USERNAME}} Has Brought to Light... Miss THOSE DAYS...",2019-11-24,4,sports_&_gaming,1198440807008808960
940,Pre-save my new album  Deezel Cobretti  on Spotify: {{URL}} (powered by {@DistroKid@} ),2019-11-24,2,pop_culture,1198441833203982337
941,Great big fight feel main event in {@Tessa Blanchard@} v {{USERNAME}} . Tessa s reign full of excellent matches adding to the legacy. Big time cool moment for new champ #wowsuperheroes,2019-11-24,4,sports_&_gaming,1198443005386117120
942,Fans: Harry Styles covering Temporary Fix or Take Me to Church - Sign the Petition! {{URL}} via {@Change org@},2019-11-24,2,pop_culture,1198443178581483520
943,Coldplay won t tour its new album until the band s concerts can be environmentally  beneficial  - Music News - ABC News {{URL}} via {{USERNAME}},2019-11-24,2,pop_culture,1198444545127538689
944,"Main event coming up in #Niagara! Lucas Bahdi (6-0-0, 6KOs) takes on Victor Cardozo (29-12-2, 21KOs) of Villeta, Paraguay! #boxing {{USERNAME}} {{USERNAME}} ",2019-11-24,4,sports_&_gaming,1198445475596247040
945,"259 entries for Day 1B $500k GTD {@WPTDeepStacks@} $1,500 Main Event  Play to Midnight, Day 2 Noon Sunday  Livestream final table Noon Monday  3 additional Sunday and 1 more Monday postlim tourney  Schedule: {{URL}} Structures: {{URL}} ",2019-11-24,4,sports_&_gaming,1198449885634187264
946,"The added money seems to follow me wherever I go. $22,960 overlay at the {{USERNAME}} Main Event. Players love it, but it’s getting tougher to find work... Kidding of course, but it IS great to work for places that always honor their guarantees. #OverlayTD",2019-11-24,4,sports_&_gaming,1198450645478436864
947,[Live Updates] Cards are in the air in the {@World Poker Tour@} Cambodia Season 18 Main Event Day 2. Follow us! #WPTCambodia: {{URL}},2019-11-24,4,sports_&_gaming,1198469758124838913
948,EXCLUSIVE: {@Counterparts@} Vocalist Brendan Murphy Interview on New Album ‘Nothing Left to Love’ {{URL}},2019-11-24,2,pop_culture,1198470995402608640
949,Pre-save my new album  Reality(instrumental Edition)  on Spotify: {{URL}} (powered by {@DistroKid@} ),2019-11-24,2,pop_culture,1198473640586731520
950,Check out my new album  IN DA FOG Beats  distributed by {@DistroKid@} and live on Google Play! {{URL}},2019-11-24,2,pop_culture,1198496312599015424
951,"♫ My Top 5 #lastfm artists: Tokio Hotel (31), Harry Styles (21), Bring Me the Horizon (9), Hawthorne Heights (6) & Andrea Bocelli (5) #weeklymusic via {{USERNAME}} ",2019-11-24,2,pop_culture,1198496531831091200
952,Harry Styles Features an Ex-Girlfriend’s Voice On His New Album {{URL}} via {@Just Jared Jr@},2019-11-24,2,pop_culture,1198497005116567553
953,Fans think the ex on Harry Styles s Fine Line album is Camille Rowe {{URL}} via {@Metro@},2019-11-24,2,pop_culture,1198497662770778112
954,Harry Styles Says Zayn Malik Leaving One Direction Made The Guys Become Even Closer {{URL}} via {@Just Jared Jr@},2019-11-24,2,pop_culture,1198498335688155136
955,Harry Styles Says One Direction ‘Became Closer’ After Zayn’s Departure {{URL}} {@PopCrush@},2019-11-24,2,pop_culture,1198498612264747008
956,"Yes !! {@Burna Boy@} preserve your Grammy nominated self. If SA can’t get it together then be safe for us  and please when you win that Grammy Cos you will win, Take all the giants on the stage with you. Wiz, David , tiwa , Yemi , tekno. History is about to be made !!!",2019-11-24,2,pop_culture,1198503340113563648
957,Pre-save my new album  Golden Boy  on Spotify: {{URL}} (powered by {@DistroKid@} ),2019-11-24,2,pop_culture,1198503794461425666
958,Pre-save my new album  Sun Shine  on Spotify: {{URL}} (powered by {@DistroKid@} ),2019-11-24,2,pop_culture,1198503895535742976
959,2015 ADCC World Champion {@Davi Ramos@} is main eventing Fight 2 Win 132 tonight.   Don t miss this amazing main event,2019-11-24,4,sports_&_gaming,1198504020920295424
960,Check out my new album  Stir Crazy  distributed by {@DistroKid@} and live on Apple Music! {{URL}},2019-11-24,2,pop_culture,1198523928622313472
961,Stream {@Flipp Dinero@} ’s New Album ‘Love For Guala’ #LoveForGuala {{URL}},2019-11-24,2,pop_culture,1198524152996646912
962,"Harry Styles carpool 2 is gonna be airpool, streetpool?! Im kinda into it James {@The Late Late Show with James Corden@} ✌️",2019-11-24,2,pop_culture,1198524609756385281
963,Missing #PWRVendetta today but watching #NXTTakeOver: War Games IN FULL to make up for it. The women s match was L-I-T. The number 1 contendership match was fun. {@Finn Blor@} as a heel was HOTTT. Let s see how the main event match goes.,2019-11-24,4,sports_&_gaming,1198527961877450752
964,"Absolutely loved {@Scroobius Pip@} ’s interview with {@DJ Shadow Official@} . Best podcast I’ve listened to in a long time, and the new album is a masterpiece. #djshadow #music #podcast #history",2019-11-24,2,pop_culture,1198529753785020416
965,Debunking the Sports Media s Excuses for the Browns  Myles Garrett and the Helmet-Swinging Incident {{URL}} via {{USERNAME}},2019-11-24,4,sports_&_gaming,1198531839268311040
966,"Bit sad to see Amanda Farrugia call it a day. Superb leader at the Giants, a real heart and soul kind of player.  I d say Alicia Eva has some shoes to fill, but I think she ll fly as new captain. #AFLW {@GWS GIANTS@} #womensfooty",2019-11-24,4,sports_&_gaming,1198535905759256577
967,"Roha vote #아스트로 and stream the new Album #블루플레임. LET S GET IT, ROHAS! {@ASTRO@} FIGHTING",2019-11-24,2,pop_culture,1198561300621729793
968,"Rohas make #ASTRO WIN  VOTE FOR #아스트로 on Mwave and starplay and stream the  new Album #블루플레임. LET S GET IT, ROHAS! {@ASTRO@} ",2019-11-24,2,pop_culture,1198563616460554243
969,I just spammed niall questions if  so long  is included in his new album {@Niall Horan@},2019-11-24,2,pop_culture,1198565647111925760
970,"A conversation with {@Labrinth@} about his brilliant new album Imagination & The Misfit Kid, his Grammy nominations, composing for Euphoria, working with Beyoncé, Sia, Kanye & Zendaya, his hope to record with Sir Paul McCartney & future plans.. {{URL}} #Labrinth",2019-11-24,2,pop_culture,1198568050506776576
971,Check out this fab new album  Ignorance Is Bliss  distributed by {@DistroKid@} and live on iTunes! {{URL}} {{USERNAME}} what do you think xx,2019-11-24,2,pop_culture,1198570979519283205
972,"Check out my new album  Above the Rain  distributed by {@DistroKid@} and live on Apple Music! {{URL}} Each song tells a story That may resonate with you Please follow and retweet Oh, and download, thank you. Popsd",2019-11-24,2,pop_culture,1198591092205260800
973,"Check out my new album  Above the Rain  distributed by {@DistroKid@} and live on Google Play! {{URL}} Each song tells a story That may resonate with you Please follow and retweet Oh, and download, thank you. Popsd",2019-11-24,2,pop_culture,1198592224981848071
974,"Check out my new album  Above the Rain  distributed by {@DistroKid@} and live on iTunes! {{URL}} Each song tells a story That may resonate with you Please follow and retweet Oh, and download, thank you. Popsd",2019-11-24,2,pop_culture,1198592833546047490
975,Alamo City Fight Night: Daniel  Da Beast  Baiz vs. Ysreal Barboza {{URL}} via {@YouTube@} My boy Baiz had the 4th and 5th round. Give it to him!!!,2019-11-24,4,sports_&_gaming,1198593858361339904
976,"Check out my new album  Above the Rain  distributed by {@DistroKid@} and live on iHeartRadio! {{URL}} Enjoy, retweet, like, follow, download. Thank you Popsd",2019-11-24,2,pop_culture,1198594266613854208
977,I think for next week we need to bring our secret weapon to the game for the Steelers Browns game!!!!! {@Caroline Collins@} you need to be at Heinz Field next Sunday!!!!! I honestly cannot wait for the rematch Caroline!!!!,2019-11-24,4,sports_&_gaming,1198599198893117442
978,Enter to see Harry Styles at The Forum from {@1043MYfm@} . {{URL}},2019-11-24,2,pop_culture,1198628108842098688
979,"Loving that new album from {{USERNAME}} . Getting major Monsoon Bassoon vibes from a lot of it (particularly ‘Bee’), which is no bad thing. Others have compared them to Cardiacs and King Crimson. All good  {{URL}} ",2019-11-24,2,pop_culture,1198628227293630476
980,A new album from {@Selena Gomez@} is coming in January and I seriously can t contain my excitement  {{URL}},2019-11-24,2,pop_culture,1198628591191252997
981,Port Harcourt are you ready for the HOME & AWAY concert with {{USERNAME}} coming on the 17th of December 2019 at HIGI HAGA along Peter Odili Road.  Time - 6pm carpet | 7pm main event.  #HomeAndAway #musicconcerts… {{URL}},2019-11-24,2,pop_culture,1198630890894585857
982,"The {{USERNAME}}  $10,000 Main Event Competition  begins on December 5th.   It consists of 5 monthly leagues, with top 20 qualifiers each month. In May those 100 play a weekend series.   Top 8 make finals.   Win= 50/50 stake in a 10k! (+1k travel) {{URL}} ",2019-11-24,4,sports_&_gaming,1198660505532895232
983,"Giants at the Bears  today...watch the Giants defense make Mitch look like elite QB, Daniel Jones will have a tough day at the office today. Best of luck today mi hermano {{USERNAME}} ",2019-11-24,4,sports_&_gaming,1198661537071800323
984,Check out my new album  Life Lessons  distributed by {@DistroKid@} and live on Apple Music! {{URL}},2019-11-24,2,pop_culture,1198719110382837761
985,The sad thing about {{USERNAME}} new album is {@MAYORKUN@} is not on it.,2019-11-24,2,pop_culture,1198720391159660545
986,I m just sitting here in the toilet listening to {{USERNAME}}  s new album and silently wishing that {{USERNAME}} and any others talking the talk of #OccupyNigeriaSeasonII will keep it going and then God s strength in their plans so we we can walk the walk.,2019-11-24,2,pop_culture,1198721489194934273
987,"Fellas no joking, why don t the Steelers look to pick up Minnesota s Jake Browning off their practice squad? He looks better than both Mason & Duck {@Andrew Stockey@} {@Guy Junker@} ",2019-11-24,4,sports_&_gaming,1198747962630901760
988,"Ron no joking, why don t the Steelers look to pick up Minnesota s Jake Browning off their practice squad? He looks better than both Mason & Duck {@Ron Cook@} ",2019-11-24,4,sports_&_gaming,1198749000444317698
989,IM SO HAPPY I GET TO SEE HARRY {@Harry Styles@} ❤️,2019-11-25,2,pop_culture,1198806599504211973
990,Winning tickets from {@NOW 100 5 FM@} to see {@Harry Styles@} in August has been the highlight of my year  Forever thankful #liveinthenow #tpwk,2019-11-25,2,pop_culture,1198843606833848320
991,Had a fantastic weekend in Budapest with family. Then it s time for {@easyJet@} to ruin it. Should ve flown 21.20 Sunday evening. Still sat I m Budapest now. No flight till 14.30pm today‍♂️‍♂️  17 hour delay. Granted a hotel was provided at 03.00am but still...shambles,2019-11-25,3,daily_life,1198895124069199872
992,"Happy to report that my {@Chris Farren@} Born Hot socks came with his new album. So, I m good to go",2019-11-25,2,pop_culture,1199108830048739328
993,"Everyone should go listen to {@Northbound@} new album, its bombbb",2019-11-25,2,pop_culture,1199113255152766976
994,"So the Ravens are destroying everybody, and the Browns destroyed the Ravens. So the {@Cleveland Browns@} are the best team in the league.",2019-11-26,4,sports_&_gaming,1199175422082265089
995,Trippie Redd’s album is the best album of 2019 by far {@Trippie Redd@},2019-11-26,2,pop_culture,1199314187366916096
996,Listen to {@Aly Fila@} new album It s All About The Melody ❤ #FSOE #TranceFamily #Trance {{URL}},2019-11-26,2,pop_culture,1199319273669304322
997,Happy Bday ChanYeol!! I hope you have a wonderful day with the members!! Saranghae!!  EXO FIGHTING!!  Also good luck on the release of the new album!! #HappyChanyeolDay {@EXO@},2019-11-26,2,pop_culture,1199352978303373312
998,Please I bet {@Harry Styles@} gives the best hugs. He’s tall so I bet he goes into the hug and just ugh,2019-11-26,2,pop_culture,1199417078421180416
999,"I do not have the chance to be present tomorrow for the preview of your album, but know that I love you more than anything. I am broken but I keep a little hope of one day meeting you. I hope that you are happy and that you are well that s all that matters to me. {@Harry Styles@} ",2019-11-26,2,pop_culture,1199445114621444098
1000,"The 2010s weren t always kind to the Steelers. Here s a look at the best and worst moments of the decade, via {@Ed Bouchette@} and {@Mark Kaboly@} : {{URL}} ",2019-11-26,4,sports_&_gaming,1199446451962732544
1001,"Really disheartening when my phone has not rung once all week and I have not had the chance to answer with, “ {@Harry Styles@} is Fine” to anyone  Over-the-moon and really happy for those that have received a phone call though  {@Ash London LIVE@} ",2019-11-27,2,pop_culture,1199530847600119808
1002,I would like to thank everyone at the Giants who have supported me down the years and I wish the club well in the years ahead.   But now his focus is on {@Leeds Rhinos@} {{USERNAME}} reports {{URL}},2019-11-27,4,sports_&_gaming,1199778669344018438
1003,"New Album By {{USERNAME}} dope!! Go Listen {{USERNAME}} {{USERNAME}} {{USERNAME}} {{USERNAME}} {{USERNAME}} {{USERNAME}} {{USERNAME}} {{USERNAME}} {{USERNAME}} Sore with your family and friends, Share Your Thoughts!!! {@Sony Music@} {@Def Jam Recordings@} {{URL}} ",2019-11-27,2,pop_culture,1199830379580010497
1004,The {@Jessika Carr@} news is amazing. While watching the main event tonight i thought to myself you’ve become one of the best Refs around.,2019-11-28,4,sports_&_gaming,1199899167272964096
1005,Happy Thanksgiving to {@Harry Styles@} ONLY.  . . . . . Even if you don’t celebrate it.,2019-11-28,2,pop_culture,1199979689227350016
1006,. {@Consequence@} of Sound feature {{USERNAME}} in their Metal Mining column - the best underground releases for Nov.    Very few bands are this creative and this seemingly unbound by sonic barriers.   New album Ÿ is out tomorrow via {{USERNAME}} {{URL}},2019-11-28,2,pop_culture,1200075111392522240
1007,"Holidays aren’t really my thing but {@Trisha Paytas@} dropped her new album today so it’s a goooood day. Everyone check out Rebirth. It’s so good, I’ll be listening allllll day.",2019-11-28,2,pop_culture,1200075470869544960
1008,Happy thanksgiving y all know who I m thankful for and its {@Harry Styles@},2019-11-28,2,pop_culture,1200105929141882882
1009,Happy Thanksgiving to everyone but especially to {{USERNAME}} and {@Harry Styles@},2019-11-28,2,pop_culture,1200108287414415361
1010,Happy Thanksgiving! {{USERNAME}} {{USERNAME}} {{USERNAME}} {{USERNAME}} {@Cleveland Browns@} {{USERNAME}} {{USERNAME}} {{USERNAME}} and all the Browns supporters out there.,2019-11-28,4,sports_&_gaming,1200135658821574657
1011,Happy thanksgiving everyone very thankful for {@Harry Styles@} {@Louis Tomlinson@} {@Niall Horan@} {@Liam@},2019-11-28,2,pop_culture,1200136389301592069
1012,I am thankful for {@Bernie Sanders@} and {@Harry Styles@} . #treatpeoplewithkindness #NotMeUs #Thanksgiving,2019-11-28,2,pop_culture,1200137244842971136
1013,Check out my new album  The Best Is Yet to Come  distributed by {@DistroKid@} and live on Napster! {{URL}},2019-11-28,2,pop_culture,1200168734394109954
1014,im thankful for a lot of people but i’m mostly thankful for you guys. thank u for always being there for me ilysm {@Ariana Grande@} {@Louis Tomlinson@} {@Harry Styles@} {@Liam@} {@Niall Horan@} {@zayn@} {@5 Seconds Of Summer@},2019-11-28,2,pop_culture,1200170421057982464
1015,CONFIRMED   Eminem will be featured on {@FAT JOE@}  s new album  Family Ties  dropping on December 6th !   WORLD AIN T READY FOR THIS. {{URL}},2019-11-28,2,pop_culture,1200171514169110534
1016,I don’t celebrate thanksgiving but I just want to say how thankful I am for {@One Direction@} for being 5 amazing guys with 5 wonderful albums! I love and miss you guys  {@Liam@} {@zayn@} {@Louis Tomlinson@} {@Harry Styles@} {@Niall Horan@},2019-11-28,2,pop_culture,1200198738674954241
1017,happy thanksgiving to all the harries out there!! happy holidays everyone!! hope y’all got your belly’s full with some good food  {@Harry Styles@},2019-11-29,2,pop_culture,1200222331941117952
1018,the way that i want to scream rn makes me very thankful that there is a whole album and 2 new singles from {@Harry Styles@} out there to keep me in check. i’m only thankful for harry styles.,2019-11-29,2,pop_culture,1200255602771087361
1019,I just want to say how thankful I am to {@Harry Styles@} for giving me courage & excitement for the future & the life I want to live. I also want to thank him for giving me the opportunity to have all of you. I love you all so much. I’m so thankful for the support & love you give,2019-11-29,2,pop_culture,1200258345766129666
1020,Pre-save my new album  Happy Bricksgiving 3  on Spotify: {{URL}} (powered by {@DistroKid@} ),2019-11-29,2,pop_culture,1200321247093182465
1021,Alvin Kamara being bested by Russell Gage and Jared Cook in my {{USERNAME}} Main Event #NotThankful,2019-11-29,4,sports_&_gaming,1200378042968870912
1022,"6 hour delay, no message, no alert. Lost a whole day of travel to visit with my family we won’t get back. Thanks {@JetBlue@} ",2019-11-29,3,daily_life,1200378148002684928
1023,I’m so thankful to you for being the reason that I’m living for. I love u so much! {@Harry Styles@},2019-11-29,2,pop_culture,1200378766591221760
1024,"Happy #BlackFridaySale You can preorder my new album now! And, {@Apple Music@} users get free singles too! Official drop date: JANUARY 31st let’s goooooo! #WOMAN #ExplorePage {{URL}} ",2019-11-29,2,pop_culture,1200412762121351173
1025,"Watch: #Oklahoma musician {{USERNAME}} releases new album  The #Christmas Light,  with the music video for  Home Movies  #HappyHolidays {{URL}} ",2019-11-29,2,pop_culture,1200497621674147840
1026,4 hour delay on the way to atl and 25 minute delay sitting waiting for the grounds crew on the way back. Wonderful traveling this holiday season {{USERNAME}} {@Delta@} #3kids #allthegerms,2019-11-29,3,daily_life,1200502900243468291
1027,. {@FAT JOE@} Reveals {@Marshall Mathers@} is Featuring on his New Album ‘Family Ties’ {{URL}},2019-11-30,2,pop_culture,1200678095751041024
1028,i actually can’t believe it’s been 2 years since the best night ever aka the iconic Harry melbourne show ❤️ {@Harry Styles@},2019-11-30,2,pop_culture,1200712839796678658
1029,"hi angel {@Harry Styles@} ♡ hope you re well☆ I was thinking how much thankful I am to have an idol like you, truly. i wish you all the love in the world but most of all i wish it from myself♡ hope you have a lovely day! take care. your friend, always. Laura ♡♡",2019-11-30,2,pop_culture,1200769482358239232
1030,I’m so happy {@camila@} ’s new album will include First Man  Been my fave for such a long time and I always wanted a official release of it. So excited for #romance,2019-11-30,2,pop_culture,1200890499999129601
1031,". {@The Rolling Stones@} , {@Mick Jagger@} , you re still being blamed by Australian media, 50 years later, for killing the American  Counter-Culture  and  The Hippy Dream  at Altamont. Apparently the Stones forced young American hippies to become crazed-with-greed capitalists. Such influence.",2019-12-01,2,pop_culture,1200953841891467264
1032,Spending Thanksgiving break with {{USERNAME}} watching Demon Slayer has been the best way to spend the break.,2019-12-01,3,daily_life,1200953915178659840
1033,#ChristmasinRome {@Hallmark Channel@} {@Sam Page@} {{USERNAME}} Wow those are amazing bright christmas lights outside the Hotel.,2019-12-01,2,pop_culture,1200955295482155008
1034,I love Christmas lights {@Hallmark Channel@} #CountdowntoChristmas #ChristmasInRome #ad,2019-12-01,2,pop_culture,1200955324309655552
1035,Epi 7 of {@The Morning Show@} - {@Mindy Kaling@}  parading around a couple of white women to show how progressive the network is...while the brown people are left to make sure the trains of their dresses don t touch the ground.  I find this extremely ironic when her character is AUDRA.,2019-12-01,2,pop_culture,1200956948008591360
1036,"Two more W’s today and the u-19 Breakers head to the State Championship finals vs the {{USERNAME}} . Great game, tickets almost sold out! {{USERNAME}} {{USERNAME}} {{USERNAME}} {{USERNAME}} ",2019-12-01,4,sports_&_gaming,1200982143658340353
1037,Nintendo Switch Lite Zacian and Zamazenta Pokemon Edition in stock at Walmart {{URL}} for $259 | Get The Tracker App {{USERNAME}},2019-12-01,4,sports_&_gaming,1200984311832252416
1038,7 years later and {@Dylan Playfair@} is still the LOML,2019-12-01,2,pop_culture,1200985209958805504
1039,I m really glad {@Netflix@} picked up {@Lucifer@} ❤ #Lucifer,2019-12-01,2,pop_culture,1200985858997919744
1040,Stay strong {{USERNAME}} Nandito kami for you mylab Queen Sun,2019-12-01,2,pop_culture,1200986208131633154
1041,"I want an official announcement first. Huhu but with all these tweets, please stay strong {{USERNAME}} , tita {{USERNAME}} and kuya {{USERNAME}} All my prayers are with you and your family. Sending hugs from where am I to where you all are. ❤️",2019-12-01,3,daily_life,1200986453540364289
1042,So {@Knives Out@} was good but it is NOT really a comedy. For some reason I had in my mind this was more Clue-like silliness but it really is more Agatha Christie. I need to rewatch the trailer to see why I thought it was a comedy.,2019-12-01,2,pop_culture,1200987732484317184
1043,Robo Alive Junior Baby Shark Sing and Swim Bath Toy in stock at Walmart {{URL}} for $22.75 | Get The Tracker App {{USERNAME}},2019-12-01,1,business_&_entrepreneurs,1201009990661574656
1044,Bills Player After Cowboys Win: “I See Why You Don’t Pay Dak” {{URL}} via {{USERNAME}},2019-12-01,4,sports_&_gaming,1201011782069960704
1045,Repost from {{USERNAME}} • The Aggie Gentz 5th Quarter Event is SOLD OUT‼️ . . NO TICKETS WILL BE SOLD AT THE DOOR. . . We appreciate everyone s overwhelming support!  See you in the… {{URL}},2019-12-01,0,arts_&_culture,1201015024371683328
1046,Brown now has 10 TD s this season...seven through the ground game.   Cal also has scored twice inside the red zone tonight...continuing UCLA s woes inside the 20-yard line. {{USERNAME}} {{USERNAME}} {{USERNAME}},2019-12-01,4,sports_&_gaming,1201017112484990979
1047,. {@Air Force Football@} posted its first 10-win regular season under head coach Troy Calhoun and first since the 1998 team went 11-1 and picked up the programs 400th win {{URL}},2019-12-01,4,sports_&_gaming,1201017635313291266
1048,L.O.L. Surprise! Bigger Surprise! in stock at Walmart {{URL}} for $129.96 | Get The Tracker App {{USERNAME}},2019-12-01,1,business_&_entrepreneurs,1201040788668342274
1049,UVTraveler {{USERNAME}} - Rooted In The Ground  #kbradiothp #kbindieradio {{URL}},2019-12-01,2,pop_culture,1201041507609927680
1050,Live Updates: {@SIMBA@} On Stage Sierra Leon National Stadium... sold out!!! ✔✔ #KillerMe {{URL}},2019-12-01,2,pop_culture,1201047435751108609
1051,Monopoly for Millennials in stock at Walmart {{URL}} for $40.99 | Get The Tracker App {{USERNAME}},2019-12-01,1,business_&_entrepreneurs,1201069469507866624
1052,"The {{USERNAME}} welcomes {{USERNAME}} tonight at 7pm for the first of two sold out performances this December. If you love Whitney, try and grab a return ticket!",2019-12-01,2,pop_culture,1201101967344521218
1053,A FAMILY STAYS TOGETHER STAY STRONG TOGETHER {@BTS_twt@} #FLYHIGHBTS #FAMILYGOALS #STAYSYRONG❤️,2019-12-01,3,daily_life,1201103842294689792
1054,"14 years later, {@SUPER JUNIOR@} ’s Kim Heechul is still my biggest what if.",2019-12-01,2,pop_culture,1201104082489888768
1055,#BTSWorldWidePerformers {@BTS_twt@} is the world greatest performers watch this video and you ll see why {{URL}},2019-12-01,2,pop_culture,1201104577937805312
1056,"Fingers crossed for a speedy recovery, champ!   Nicky Henderson is hopeful Buveur D Air will make a full recovery from the injury he picked up in the {@Betfair@} Fighting Fifth Hurdle - but whether he runs again this season is a  grey area . ",2019-12-01,4,sports_&_gaming,1201106166551588864
